requestId,userId,gymDetails,requestDate
1,37,pede malesuada in imperdiet et commodo vulputate justo in blandit ultrices enim lorem ipsum dolor sit amet consectetuer adipiscing elit proin interdum mauris non ligula pellentesque ultrices,5/14/2022
2,35,ligula suspendisse ornare consequat lectus in est risus auctor sed tristique in tempus sit amet sem fusce consequat nulla nisl nunc nisl duis bibendum,10/1/2010
3,38,risus semper porta volutpat quam pede lobortis ligula sit amet eleifend pede libero quis orci nullam molestie nibh in lectus pellentesque at nulla suspendisse potenti cras in purus eu magna,7/23/2023
4,37,pulvinar nulla pede ullamcorper augue a suscipit nulla elit ac nulla sed vel enim sit amet nunc viverra dapibus nulla suscipit ligula in lacus curabitur at,8/18/2020
5,16,lobortis ligula sit amet eleifend pede libero quis orci nullam molestie nibh in lectus pellentesque,7/13/2010
6,11,tortor duis mattis egestas metus aenean fermentum donec ut mauris eget massa tempor convallis,2/8/2024
7,13,ultrices libero non mattis pulvinar nulla pede ullamcorper augue a suscipit nulla elit ac nulla sed vel enim sit amet nunc viverra dapibus nulla suscipit ligula in lacus curabitur at ipsum ac tellus semper interdum mauris,2/17/2025
8,5,sapien placerat ante nulla justo aliquam quis turpis eget elit sodales scelerisque mauris sit amet eros,7/17/2010
9,18,ipsum praesent blandit lacinia erat vestibulum sed magna at nunc commodo placerat praesent blandit nam nulla integer pede justo lacinia eget tincidunt eget tempus vel pede morbi porttitor lorem id ligula suspendisse ornare consequat lectus in,10/7/2012
10,26,ridiculus mus vivamus vestibulum sagittis sapien cum sociis natoque penatibus et magnis dis parturient montes nascetur ridiculus mus etiam vel augue vestibulum rutrum rutrum neque,11/9/2010
11,1,pulvinar nulla pede ullamcorper augue a suscipit nulla elit ac nulla sed vel enim sit amet nunc viverra dapibus nulla suscipit ligula in lacus curabitur at ipsum ac tellus semper interdum mauris,4/26/2019
12,20,habitasse platea dictumst etiam faucibus cursus urna ut tellus nulla ut erat id mauris vulputate elementum nullam varius nulla facilisi cras non velit nec nisi vulputate nonummy maecenas tincidunt lacus at velit vivamus vel nulla eget eros elementum pellentesque quisque,7/3/2020
13,13,mi sit amet lobortis sapien sapien non mi integer ac neque duis bibendum morbi non quam nec dui luctus rutrum nulla tellus in sagittis,2/13/2016
14,6,accumsan odio curabitur convallis duis consequat dui nec nisi volutpat eleifend donec ut dolor morbi vel lectus in quam fringilla rhoncus,12/7/2019
15,27,quis tortor id nulla ultrices aliquet maecenas leo odio condimentum id luctus nec molestie sed justo pellentesque viverra pede ac diam cras pellentesque volutpat dui maecenas tristique est et tempus semper est quam pharetra magna ac,3/10/2022
16,27,faucibus orci luctus et ultrices posuere cubilia curae duis faucibus accumsan odio curabitur convallis duis consequat dui nec nisi volutpat eleifend donec ut dolor,3/13/2019
17,11,sollicitudin ut suscipit a feugiat et eros vestibulum ac est lacinia nisi venenatis tristique fusce congue diam id ornare imperdiet sapien urna pretium nisl,1/16/2020
18,4,libero convallis eget eleifend luctus ultricies eu nibh quisque id justo sit amet sapien dignissim vestibulum vestibulum ante ipsum primis in,4/12/2013
19,23,odio in hac habitasse platea dictumst maecenas ut massa quis augue,7/22/2022
20,30,placerat praesent blandit nam nulla integer pede justo lacinia eget tincidunt eget tempus vel pede morbi porttitor lorem id ligula suspendisse ornare consequat lectus in est risus auctor sed tristique in tempus sit amet sem,3/14/2012
21,12,orci luctus et ultrices posuere cubilia curae duis faucibus accumsan odio curabitur convallis duis,10/13/2010
22,20,duis bibendum morbi non quam nec dui luctus rutrum nulla tellus in sagittis dui vel nisl duis ac nibh fusce lacus purus aliquet at feugiat non pretium quis lectus suspendisse potenti in eleifend quam a odio in hac habitasse platea,4/15/2020
23,24,posuere metus vitae ipsum aliquam non mauris morbi non lectus aliquam sit amet diam,11/3/2023
24,11,suspendisse accumsan tortor quis turpis sed ante vivamus tortor duis mattis egestas metus aenean fermentum donec ut mauris eget massa tempor convallis nulla neque libero convallis eget eleifend luctus ultricies eu,5/28/2016
25,26,felis donec semper sapien a libero nam dui proin leo odio porttitor id consequat in consequat,6/22/2019
26,27,pharetra magna ac consequat metus sapien ut nunc vestibulum ante ipsum primis in,11/7/2024
27,2,dui vel nisl duis ac nibh fusce lacus purus aliquet at feugiat non pretium quis lectus suspendisse potenti in eleifend quam a odio in hac habitasse platea dictumst maecenas ut massa quis augue luctus tincidunt nulla mollis,12/3/2011
28,37,nibh ligula nec sem duis aliquam convallis nunc proin at turpis a pede posuere nonummy integer non velit donec diam neque vestibulum eget vulputate ut ultrices vel augue vestibulum ante,2/5/2013
29,38,turpis donec posuere metus vitae ipsum aliquam non mauris morbi non lectus aliquam sit amet diam in magna bibendum imperdiet nullam orci pede venenatis non,1/10/2014
30,11,mi pede malesuada in imperdiet et commodo vulputate justo in blandit ultrices,6/26/2019
31,14,felis fusce posuere felis sed lacus morbi sem mauris laoreet,12/9/2017
32,39,vel nisl duis ac nibh fusce lacus purus aliquet at feugiat non pretium quis lectus suspendisse potenti in,2/15/2017
33,29,ac consequat metus sapien ut nunc vestibulum ante ipsum primis in faucibus orci luctus et ultrices posuere cubilia curae mauris viverra diam vitae quam suspendisse potenti nullam porttitor lacus,12/20/2012
34,2,nisl venenatis lacinia aenean sit amet justo morbi ut odio cras mi pede malesuada in imperdiet et commodo vulputate justo in blandit ultrices enim lorem ipsum dolor,7/24/2021
35,19,est donec odio justo sollicitudin ut suscipit a feugiat et eros vestibulum ac est lacinia nisi venenatis tristique fusce congue diam id ornare imperdiet sapien urna pretium nisl ut volutpat,10/3/2021
36,36,sapien arcu sed augue aliquam erat volutpat in congue etiam justo etiam pretium iaculis justo in hac habitasse platea dictumst etiam faucibus,7/9/2020
37,12,nullam molestie nibh in lectus pellentesque at nulla suspendisse potenti cras in purus eu magna vulputate luctus cum sociis natoque penatibus et magnis dis parturient montes nascetur ridiculus mus vivamus vestibulum sagittis sapien cum sociis natoque penatibus et,7/12/2024
38,28,at velit vivamus vel nulla eget eros elementum pellentesque quisque porta volutpat,8/16/2022
39,7,enim lorem ipsum dolor sit amet consectetuer adipiscing elit proin interdum mauris non ligula pellentesque ultrices phasellus id sapien in sapien iaculis congue vivamus metus arcu adipiscing molestie hendrerit at vulputate vitae nisl aenean lectus pellentesque eget,6/26/2017
40,1,nullam porttitor lacus at turpis donec posuere metus vitae ipsum aliquam non mauris morbi non lectus aliquam sit amet diam in magna bibendum imperdiet nullam orci pede venenatis non sodales sed tincidunt eu felis fusce,9/25/2021
41,15,enim blandit mi in porttitor pede justo eu massa donec dapibus duis at velit eu est congue elementum in hac habitasse platea dictumst morbi vestibulum velit id pretium iaculis diam erat fermentum justo,4/28/2014
42,14,at feugiat non pretium quis lectus suspendisse potenti in eleifend quam a odio in hac habitasse platea dictumst maecenas ut massa quis augue luctus tincidunt nulla mollis molestie lorem quisque,7/29/2022
43,26,eget congue eget semper rutrum nulla nunc purus phasellus in felis donec semper sapien a libero nam dui proin leo odio porttitor id consequat in consequat ut nulla sed accumsan felis ut,10/25/2016
44,11,enim in tempor turpis nec euismod scelerisque quam turpis adipiscing lorem vitae mattis nibh ligula nec sem,7/6/2014
45,34,cras pellentesque volutpat dui maecenas tristique est et tempus semper est quam pharetra magna ac consequat metus sapien ut nunc vestibulum ante ipsum primis in faucibus orci luctus et ultrices posuere cubilia curae mauris,6/5/2012
46,18,dapibus augue vel accumsan tellus nisi eu orci mauris lacinia sapien quis libero nullam sit amet turpis elementum ligula vehicula consequat morbi a ipsum integer a nibh in quis justo maecenas rhoncus aliquam lacus morbi quis tortor id nulla,6/3/2015
47,10,pede ullamcorper augue a suscipit nulla elit ac nulla sed vel enim sit amet nunc viverra dapibus nulla suscipit ligula in lacus curabitur at ipsum ac tellus semper interdum mauris ullamcorper purus sit amet nulla quisque,10/8/2012
48,9,venenatis lacinia aenean sit amet justo morbi ut odio cras mi,7/1/2020
49,38,consequat metus sapien ut nunc vestibulum ante ipsum primis in faucibus orci luctus et ultrices posuere cubilia curae mauris viverra diam,6/19/2011
50,34,iaculis justo in hac habitasse platea dictumst etiam faucibus cursus urna ut tellus nulla ut erat id mauris vulputate elementum nullam varius,12/27/2017
